[
  {
    "id": "sa-king",
    "name": "King of Saudi Arabia",
    "name_ar": "ملك المملكة العربية السعودية",
    "jurisdiction": "SA",
    "type": "head_of_state",
    "mandate": "Enacts primary legislation by royal decree on approval of the Council of Ministers and the Shura Council.",
    "website": null
  },
  {
    "id": "sa-sdaia",
    "name": "Saudi Data and AI Authority",
    "name_ar": "الهيئة السعودية للبيانات والذكاء الاصطناعي",
    "jurisdiction": "SA",
    "type": "sectoral_regulator",
    "mandate": "National competent authority for data governance, personal data protection, and artificial intelligence in Saudi Arabia.",
    "website": "https://sdaia.gov.sa"
  },
  {
    "id": "ae-president",
    "name": "President of the United Arab Emirates",
    "name_ar": "رئيس دولة الإمارات العربية المتحدة",
    "jurisdiction": "AE",
    "type": "head_of_state",
    "mandate": "Enacts federal decree laws and federal laws on the federal legislative process of the UAE.",
    "website": null
  },
  {
    "id": "ae-uae-data-office",
    "name": "UAE Data Office",
    "name_ar": "مكتب الإمارات للبيانات",
    "jurisdiction": "AE",
    "type": "sectoral_regulator",
    "mandate": "Federal data protection regulator established to supervise the UAE Personal Data Protection Law and propose data policies.",
    "website": null
  },
  {
    "id": "ae-ai-office",
    "name": "UAE Artificial Intelligence, Digital Economy and Remote Work Applications Office",
    "name_ar": "مكتب الذكاء الاصطناعي والاقتصاد الرقمي وتطبيقات العمل عن بعد",
    "jurisdiction": "AE",
    "type": "ministry",
    "mandate": "Government office leading UAE policy on artificial intelligence and the digital economy.",
    "website": "https://ai.gov.ae"
  },
  {
    "id": "ae-difc-cdp",
    "name": "DIFC Commissioner of Data Protection",
    "name_ar": "مفوض حماية البيانات في مركز دبي المالي العالمي",
    "jurisdiction": "AE",
    "type": "free_zone_authority",
    "mandate": "Supervises and enforces the Data Protection Law of the Dubai International Financial Centre.",
    "website": "https://www.difc.com"
  },
  {
    "id": "ae-adgm-odp",
    "name": "ADGM Office of Data Protection",
    "name_ar": "مكتب حماية البيانات في سوق أبوظبي العالمي",
    "jurisdiction": "AE",
    "type": "free_zone_authority",
    "mandate": "Administers and enforces the Data Protection Regulations of Abu Dhabi Global Market.",
    "website": "https://www.adgm.com"
  },
  {
    "id": "bh-king",
    "name": "King of Bahrain",
    "name_ar": "ملك مملكة البحرين",
    "jurisdiction": "BH",
    "type": "head_of_state",
    "mandate": "Ratifies and promulgates laws passed by the National Assembly of Bahrain.",
    "website": null
  },
  {
    "id": "bh-pdpa",
    "name": "Bahrain Personal Data Protection Authority",
    "name_ar": "هيئة حماية البيانات الشخصية",
    "jurisdiction": "BH",
    "type": "sectoral_regulator",
    "mandate": "Supervises and enforces the Bahrain Personal Data Protection Law.",
    "website": "https://www.pdp.gov.bh"
  },
  {
    "id": "bh-cbb",
    "name": "Central Bank of Bahrain",
    "name_ar": "مصرف البحرين المركزي",
    "jurisdiction": "BH",
    "type": "central_bank",
    "mandate": "Regulates and supervises the banking, insurance, and capital markets sectors in Bahrain through the CBB Rulebook.",
    "website": "https://www.cbb.gov.bh"
  },
  {
    "id": "qa-emir",
    "name": "Emir of Qatar",
    "name_ar": "أمير دولة قطر",
    "jurisdiction": "QA",
    "type": "head_of_state",
    "mandate": "Enacts laws and emiri decrees under the Constitution of Qatar.",
    "website": null
  },
  {
    "id": "qa-ncsa",
    "name": "Qatar National Cyber Security Agency",
    "name_ar": "الوكالة الوطنية للأمن السيبراني",
    "jurisdiction": "QA",
    "type": "sectoral_regulator",
    "mandate": "National authority for cybersecurity in Qatar, hosting the compliance and data protection function for the personal data privacy law.",
    "website": "https://www.ncsa.gov.qa"
  },
  {
    "id": "qa-qfc-dpo",
    "name": "QFC Data Protection Office",
    "name_ar": "مكتب حماية البيانات في مركز قطر للمال",
    "jurisdiction": "QA",
    "type": "free_zone_authority",
    "mandate": "Supervises and enforces the Data Protection Regulations of the Qatar Financial Centre.",
    "website": "https://www.qfc.qa"
  },
  {
    "id": "kw-citra",
    "name": "Kuwait Communication and Information Technology Regulatory Authority",
    "name_ar": "الهيئة العامة للاتصالات وتقنية المعلومات",
    "jurisdiction": "KW",
    "type": "sectoral_regulator",
    "mandate": "Regulates telecommunications and information technology in Kuwait, including data privacy protection rules for service providers.",
    "website": "https://citra.gov.kw"
  },
  {
    "id": "om-sultan",
    "name": "Sultan of Oman",
    "name_ar": "سلطان عمان",
    "jurisdiction": "OM",
    "type": "head_of_state",
    "mandate": "Enacts laws by royal decree as the supreme legislative authority of Oman.",
    "website": null
  },
  {
    "id": "om-mtcit",
    "name": "Oman Ministry of Transport, Communications and Information Technology",
    "name_ar": "وزارة النقل والاتصالات وتقنية المعلومات",
    "jurisdiction": "OM",
    "type": "ministry",
    "mandate": "Ministry responsible for transport, communications, and information technology policy in Oman, including implementation of the personal data protection law.",
    "website": "https://www.mtcit.gov.om"
  },
  {
    "id": "bh-caa",
    "name": "Civil Aviation Affairs",
    "name_ar": null,
    "jurisdiction": "BH",
    "type": "sectoral_regulator",
    "mandate": "Regulates civil aviation, including drones and unmanned systems.",
    "website": "https://www.caa.gov.bh"
  },
  {
    "id": "bh-edb",
    "name": "Bahrain Economic Development Board",
    "name_ar": null,
    "jurisdiction": "BH",
    "type": "government_agency",
    "mandate": "Promotes investment and economic development, including digital and emerging technology initiatives.",
    "website": "https://www.bahrainedb.com"
  },
  {
    "id": "bh-gov",
    "name": "Government of Bahrain",
    "name_ar": null,
    "jurisdiction": "BH",
    "type": "government",
    "mandate": "General government of the Kingdom of Bahrain; used where the specific issuing body is unconfirmed.",
    "website": "https://www.bahrain.bh"
  },
  {
    "id": "bh-iga",
    "name": "Information and eGovernment Authority",
    "name_ar": null,
    "jurisdiction": "BH",
    "type": "government_agency",
    "mandate": "Runs national e-government services, digital identity, open data, and information policy.",
    "website": "https://www.iga.gov.bh"
  },
  {
    "id": "bh-mofne",
    "name": "Ministry of Finance and National Economy",
    "name_ar": null,
    "jurisdiction": "BH",
    "type": "ministry",
    "mandate": "Oversees public finance and national economic policy.",
    "website": "https://www.mof.gov.bh"
  },
  {
    "id": "bh-moh",
    "name": "Ministry of Health",
    "name_ar": null,
    "jurisdiction": "BH",
    "type": "ministry",
    "mandate": "Oversees public health policy and health services.",
    "website": "https://www.moh.gov.bh"
  },
  {
    "id": "bh-moic",
    "name": "Ministry of Industry and Commerce",
    "name_ar": null,
    "jurisdiction": "BH",
    "type": "ministry",
    "mandate": "Oversees commerce, e-commerce, and consumer protection.",
    "website": "https://www.moic.gov.bh"
  },
  {
    "id": "bh-moj",
    "name": "Ministry of Justice, Islamic Affairs and Waqf",
    "name_ar": null,
    "jurisdiction": "BH",
    "type": "ministry",
    "mandate": "Administers justice and, for the data protection law, the supervisory authority function.",
    "website": "https://www.moj.gov.bh"
  },
  {
    "id": "bh-mtt",
    "name": "Ministry of Transportation and Telecommunications",
    "name_ar": null,
    "jurisdiction": "BH",
    "type": "ministry",
    "mandate": "Oversees transportation and telecommunications policy and ministerial decisions.",
    "website": "https://www.mtt.gov.bh"
  },
  {
    "id": "bh-nbr",
    "name": "National Bureau for Revenue",
    "name_ar": null,
    "jurisdiction": "BH",
    "type": "government_agency",
    "mandate": "Administers VAT and excise, including e-invoicing and digital tax administration.",
    "website": "https://www.nbr.gov.bh"
  },
  {
    "id": "bh-ncsc",
    "name": "National Cyber Security Center",
    "name_ar": null,
    "jurisdiction": "BH",
    "type": "sectoral_regulator",
    "mandate": "Leads national cybersecurity strategy, controls, and incident response.",
    "website": "https://www.ncsc.gov.bh"
  },
  {
    "id": "bh-nhra",
    "name": "National Health Regulatory Authority",
    "name_ar": null,
    "jurisdiction": "BH",
    "type": "sectoral_regulator",
    "mandate": "Regulates healthcare providers and services, including digital and tele-health.",
    "website": "https://www.nhra.bh"
  },
  {
    "id": "bh-pm",
    "name": "Prime Minister",
    "name_ar": null,
    "jurisdiction": "BH",
    "type": "head_of_government",
    "mandate": "Issues edicts and decisions of the Council of Ministers.",
    "website": null
  },
  {
    "id": "bh-scict",
    "name": "Supreme Council for Information and Communication Technology",
    "name_ar": null,
    "jurisdiction": "BH",
    "type": "council",
    "mandate": "Sets national information and communication technology policy direction.",
    "website": null
  },
  {
    "id": "bh-shura",
    "name": "Shura Council",
    "name_ar": null,
    "jurisdiction": "BH",
    "type": "legislature",
    "mandate": "Upper chamber of the National Assembly; participates in enacting legislation.",
    "website": "https://www.shura.bh"
  },
  {
    "id": "bh-tra",
    "name": "Telecommunications Regulatory Authority",
    "name_ar": null,
    "jurisdiction": "BH",
    "type": "sectoral_regulator",
    "mandate": "Regulates the telecommunications sector, spectrum, and related digital infrastructure in Bahrain.",